{
  "id": "sb_b0d9",
  "project_id": "b0d9ceaa",
  "script_id": "scr_b0d9",
  "shots": [
    {
      "id": "SH001",
      "scene_id": "S01",
      "shot_type": "wide",
      "camera_movement": "tracking",
      "prompt": "manga style, nighttime city street with neon lights, a tired young man in wrinkled business suit walking alone, carrying laptop bag, convenience store glowing warmly in the distance, rain-wet pavement reflecting colorful lights, melancholy atmosphere, high quality, detailed",
      "video_prompt": "@Image1 作为首帧，镜头跟随疲惫的青年沿着雨后的霓虹街道走向远处发光的便利店，脚步缓慢沉重",
      "audio_prompt": "深夜城市街道，远处车流声，雨后湿润路面上的脚步声，微弱的霓虹灯电流嗡嗡声，淡淡忧伤的钢琴旋律",
      "negative_prompt": "low quality, blurry, deformed, realistic photo, 3d render",
      "characters": ["char_chenchen"],
      "dialogue_text": "",
      "duration": 5,
      "transition": "fade",
      "seedance_mode": "i2v",
      "ratio": "16:9"
    },
    {
      "id": "SH002",
      "scene_id": "S01",
      "shot_type": "medium",
      "camera_movement": "static",
      "prompt": "manga style, young man pushing open glass door of a bright convenience store, door bell ringing, warm yellow light flooding out from inside, contrast between dark outside and warm inside, night scene, high quality",
      "video_prompt": "@Image1 作为首帧，青年推开便利店玻璃门，门铃叮咚作响，温暖的灯光洒出",
      "audio_prompt": "玻璃门被推开的声音，清脆的门铃叮咚声，从室外冷清到室内温暖的音效过渡，便利店内轻柔的背景音乐",
      "negative_prompt": "low quality, blurry, deformed, realistic photo",
      "characters": ["char_chenchen"],
      "dialogue_text": "",
      "duration": 4,
      "transition": "cut",
      "seedance_mode": "i2v",
      "ratio": "16:9"
    },
    {
      "id": "SH003",
      "scene_id": "S02",
      "shot_type": "over-shoulder",
      "camera_movement": "pan-right",
      "prompt": "manga style, inside bright convenience store, young female clerk with brown ponytail and green apron smiling warmly at camera, shelves with colorful products in background, warm lighting, cozy atmosphere, high quality, detailed",
      "video_prompt": "@Image1 作为林小暖外观参考。@Image2 作为首帧，从陈辰肩膀后方看向微笑的店员，镜头缓缓右移展现便利店内景",
      "audio_prompt": "年轻女性温柔地说：'欢迎光临，今天加班到很晚吧？'，便利店内轻柔的背景音乐，冰柜低沉的嗡嗡声",
      "negative_prompt": "low quality, blurry, deformed, realistic photo",
      "characters": ["char_chenchen", "char_linxiaonuan"],
      "dialogue_text": "欢迎光临，今天加班到很晚吧？",
      "duration": 5,
      "transition": "cut",
      "seedance_mode": "multimodal",
      "ratio": "16:9"
    },
    {
      "id": "SH004",
      "scene_id": "S03",
      "shot_type": "close-up",
      "camera_movement": "static",
      "prompt": "manga style, close-up of steaming hot oden bowl being placed on table, female hands gently pushing it forward, warm steam rising, convenience store window seat background with city night view, warm and inviting, high quality, detailed",
      "video_prompt": "@Image1 作为首帧，一双温柔的手将热气腾腾的关东煮推到镜头前方，蒸汽缓缓上升",
      "audio_prompt": "陶瓷碗轻轻放在桌上的声音，热汤咕嘟冒泡声，年轻女性温柔地说：'这碗请你的，深夜还在努力的人值得被温暖。'",
      "negative_prompt": "low quality, blurry, deformed, realistic photo",
      "characters": ["char_linxiaonuan"],
      "dialogue_text": "这碗请你的，深夜还在努力的人值得被温暖。",
      "duration": 5,
      "transition": "dissolve",
      "seedance_mode": "i2v",
      "ratio": "16:9"
    },
    {
      "id": "SH005",
      "scene_id": "S03",
      "shot_type": "medium",
      "camera_movement": "zoom-in",
      "prompt": "manga style, two young people sitting side by side at convenience store window seat, eating oden together, city night lights visible through window, warm interior light, girl smiling and boy with touched expression eyes slightly red, heartwarming atmosphere, high quality, detailed",
      "video_prompt": "@Image1 作为林小暖外观参考。@Image2 作为陈辰外观参考。@Image3 作为首帧，两人并排坐在窗边，镜头缓缓推近，捕捉陈辰嘴角上扬的瞬间",
      "audio_prompt": "年轻男性声音略带哽咽：'谢谢...好久没有人这样对我说话了。'，筷子轻碰碗沿声，窗外远处城市夜景的模糊车流声，温暖的弦乐缓缓响起",
      "negative_prompt": "low quality, blurry, deformed, realistic photo",
      "characters": ["char_chenchen", "char_linxiaonuan"],
      "dialogue_text": "谢谢...好久没有人这样对我说话了。",
      "duration": 5,
      "transition": "fade",
      "seedance_mode": "multimodal",
      "ratio": "16:9"
    }
  ],
  "metadata": {
    "total_shots": 5,
    "total_duration": 24,
    "style_guide": "manga, heartwarming, urban night, warm lighting",
    "default_ratio": "16:9",
    "default_resolution": "1080p"
  }
}
